{
  "schema_version": 1,
  "corpus_id": "project-orrery-history-v1",
  "description": "Reconstructed, Git-grounded Project Orrery tasks for comparing context-routing variants. Prompts are reconstructed from commit intent; reference write paths are verified against Git diffs.",
  "tasks": [
    {
      "id": "PO-CR-001",
      "title": "Add portable installation smoke tests",
      "category": "testing",
      "risk": "medium",
      "prompt": "Add dependency-free smoke tests that install Project Orrery into isolated temporary repositories and verify that the generated documentation structure is valid.",
      "source": {
        "kind": "git_history",
        "repository": "project-orrery",
        "base_commit": "e38ef8d70cc267666f8ef3c76d01eccf0f677b4e",
        "reference_commit": "e0680523e4cacde2e8413188e04e801e9c2c1c81",
        "prompt_provenance": "reconstructed_from_commit",
        "oracle_provenance": "git_diff"
      },
      "oracle": {
        "reference_changed_paths": ["tests/test_project_orrery.py"],
        "curated_context_paths": [
          "skills/project-orrery/scripts/install_project_orrery.py",
          "skills/project-orrery/scripts/validate_installation.py",
          "skills/project-orrery/assets/project-template/AGENTS.md"
        ],
        "validation_commands": ["python -m unittest discover -s tests -v"],
        "acceptance_criteria": [
          "Tests use isolated temporary targets rather than the maintainer worktree.",
          "A fresh scaffold validates without third-party viewer dependencies."
        ]
      },
      "tags": ["installer", "validator", "temporary-repository"]
    },
    {
      "id": "PO-CR-002",
      "title": "Validate portable installs on Windows and Linux",
      "category": "ci",
      "risk": "medium",
      "prompt": "Add continuous integration that runs Project Orrery's portable installation tests on both Windows and Linux.",
      "source": {
        "kind": "git_history",
        "repository": "project-orrery",
        "base_commit": "e38ef8d70cc267666f8ef3c76d01eccf0f677b4e",
        "reference_commit": "e0680523e4cacde2e8413188e04e801e9c2c1c81",
        "prompt_provenance": "reconstructed_from_commit",
        "oracle_provenance": "git_diff"
      },
      "oracle": {
        "reference_changed_paths": [".github/workflows/validate.yml"],
        "curated_context_paths": ["tests/test_project_orrery.py", "README.md"],
        "validation_commands": ["python -m unittest discover -s tests -v"],
        "acceptance_criteria": [
          "CI covers Windows and Linux runners.",
          "The workflow executes the repository's smoke-test entry point."
        ]
      },
      "tags": ["github-actions", "windows", "linux"]
    },
    {
      "id": "PO-CR-003",
      "title": "Document installation validation",
      "category": "documentation",
      "risk": "low",
      "prompt": "Document how a user validates a freshly installed Project Orrery scaffold and its static reader.",
      "source": {
        "kind": "git_history",
        "repository": "project-orrery",
        "base_commit": "e38ef8d70cc267666f8ef3c76d01eccf0f677b4e",
        "reference_commit": "e0680523e4cacde2e8413188e04e801e9c2c1c81",
        "prompt_provenance": "reconstructed_from_commit",
        "oracle_provenance": "git_diff"
      },
      "oracle": {
        "reference_changed_paths": ["README.md"],
        "curated_context_paths": [
          "README.md",
          "skills/project-orrery/scripts/validate_installation.py",
          "skills/project-orrery/assets/project-template/scripts/docsite/requirements.txt"
        ],
        "validation_commands": ["git diff --check"],
        "acceptance_criteria": [
          "Dependency-free structure validation and optional static-build validation are distinguished.",
          "Commands use portable repository-relative paths."
        ]
      },
      "tags": ["readme", "validation", "quick-start"]
    },
    {
      "id": "PO-CR-004",
      "title": "Publish a direct installation entry",
      "category": "documentation",
      "risk": "low",
      "prompt": "Make the public README give new users a direct, copyable way to install the Project Orrery Codex Skill from GitHub.",
      "source": {
        "kind": "git_history",
        "repository": "project-orrery",
        "base_commit": "e0680523e4cacde2e8413188e04e801e9c2c1c81",
        "reference_commit": "80b17bec84b763a356f54838771d6a9d91133800",
        "prompt_provenance": "reconstructed_from_commit",
        "oracle_provenance": "git_diff"
      },
      "oracle": {
        "reference_changed_paths": ["README.md"],
        "curated_context_paths": ["README.md", "skills/project-orrery/SKILL.md"],
        "validation_commands": ["git diff --check"],
        "acceptance_criteria": [
          "The installation instruction identifies the public repository and Skill path.",
          "The README does not imply that scaffolding equals authority adoption."
        ]
      },
      "tags": ["installation", "github", "onboarding"]
    },
    {
      "id": "PO-CR-005",
      "title": "Rewrite the English public README",
      "category": "documentation",
      "risk": "medium",
      "prompt": "Rewrite the English README as a professional public introduction covering Project Orrery's purpose, authority model, safe adoption, local observatory, repository layout, and contribution path.",
      "source": {
        "kind": "git_history",
        "repository": "project-orrery",
        "base_commit": "80b17bec84b763a356f54838771d6a9d91133800",
        "reference_commit": "6a93a4469d27e46403f0250f6663ffbf9564251d",
        "prompt_provenance": "reconstructed_from_commit",
        "oracle_provenance": "git_diff"
      },
      "oracle": {
        "reference_changed_paths": ["README.md"],
        "curated_context_paths": [
          "README.md",
          "skills/project-orrery/SKILL.md",
          "skills/project-orrery/references/architecture.md",
          "skills/project-orrery/references/migration-contract.md"
        ],
        "validation_commands": ["git diff --check"],
        "acceptance_criteria": [
          "The README distinguishes decisions, plans, implementation, State, and evidence.",
          "Safety and non-destructive adoption rules remain visible."
        ]
      },
      "tags": ["readme", "public-documentation", "authority-model"]
    },
    {
      "id": "PO-CR-006",
      "title": "Add a separate Simplified Chinese README",
      "category": "documentation",
      "risk": "medium",
      "prompt": "Add a professional Simplified Chinese README as a separate document, with clear language switching and the same technical meaning as the English README.",
      "source": {
        "kind": "git_history",
        "repository": "project-orrery",
        "base_commit": "80b17bec84b763a356f54838771d6a9d91133800",
        "reference_commit": "6a93a4469d27e46403f0250f6663ffbf9564251d",
        "prompt_provenance": "reconstructed_from_commit",
        "oracle_provenance": "git_diff"
      },
      "oracle": {
        "reference_changed_paths": ["README.md", "README.zh-CN.md"],
        "curated_context_paths": [
          "README.md",
          "skills/project-orrery/SKILL.md",
          "skills/project-orrery/references/architecture.md"
        ],
        "validation_commands": ["git diff --check"],
        "acceptance_criteria": [
          "English and Chinese introductions live in separate files.",
          "Both files provide reciprocal language links and preserve the same authority boundaries."
        ]
      },
      "tags": ["i18n", "simplified-chinese", "readme"]
    },
    {
      "id": "PO-CR-007",
      "title": "Create the English documentation architecture diagram",
      "category": "architecture",
      "risk": "low",
      "prompt": "Create an English SVG overview of the Project Orrery documentation architecture with a clear, untangled main authority chain and supporting inputs.",
      "source": {
        "kind": "git_history",
        "repository": "project-orrery",
        "base_commit": "98b4d847ec5ca0010d148105d083c5529872998c",
        "reference_commit": "1ff3d577bc778f297130496376bbdce10271d57b",
        "prompt_provenance": "reconstructed_from_commit",
        "oracle_provenance": "git_diff"
      },
      "oracle": {
        "reference_changed_paths": ["docs/assets/document-architecture.en.svg"],
        "curated_context_paths": [
          "skills/project-orrery/references/architecture.md",
          "README.md",
          "docs/assets/document-architecture.en.svg"
        ],
        "validation_commands": ["git diff --check"],
        "acceptance_criteria": [
          "The SVG distinguishes authority-bearing sources from supporting inputs and derived outputs.",
          "The diagram remains readable without crossing the main chain repeatedly."
        ]
      },
      "tags": ["svg", "diagram", "english"]
    },
    {
      "id": "PO-CR-008",
      "title": "Create the Chinese documentation architecture diagram",
      "category": "architecture",
      "risk": "low",
      "prompt": "Create a Simplified Chinese SVG counterpart to the Project Orrery architecture overview while preserving the English diagram's structure and meaning.",
      "source": {
        "kind": "git_history",
        "repository": "project-orrery",
        "base_commit": "98b4d847ec5ca0010d148105d083c5529872998c",
        "reference_commit": "1ff3d577bc778f297130496376bbdce10271d57b",
        "prompt_provenance": "reconstructed_from_commit",
        "oracle_provenance": "git_diff"
      },
      "oracle": {
        "reference_changed_paths": ["docs/assets/document-architecture.zh-CN.svg"],
        "curated_context_paths": [
          "skills/project-orrery/references/architecture.md",
          "README.zh-CN.md",
          "docs/assets/document-architecture.zh-CN.svg"
        ],
        "validation_commands": ["git diff --check"],
        "acceptance_criteria": [